[
  {
    "schema_version": "1.0",
    "task_key": "cpsyexam",
    "family": "cpsyexam",
    "task_contract": { "task_type": "multiple_choice", "output_representation": "option_token_set", "canonical_output_labels": ["A", "B", "C", "D", "E"], "label_order": "declared", "dynamic_options": true, "composition_rule": "sorted_unique_option_tokens", "scoring_method": "exact_match", "invalid_counts_as_incorrect": true },
    "dataset": {
      "root_env": "EVAL_DATASETS_DIR",
      "relative_root": "CPsyExam/data/extracted_with_answer/test",
      "revision": { "kind": "dataset_release", "value": "CAS-SIAT-XinHai/CPsyExam@cf094fdc50407e2976ba7efcf9d3ab67ad0a96be;cpsyexam_with_test_answer.zip sha256 c014c5e0aa4d673d959d468e4fbc7a9f63cc96d554c7e722ae7cc5c52f5e00dd", "frozen": true },
      "availability": { "status": "present", "access": "authorized_local_only", "redistribution": "aggregate_only" }
    },
    "use_policy": {
      "selection_role": "none",
      "test_selection_prohibited": true,
      "train": { "source_split": null, "availability": "not_registered", "allowed_uses": [], "consumption_status": "not_applicable", "notes": "No training split is registered by the current answered-test runner." },
      "dev": { "source_split": null, "availability": "not_registered", "allowed_uses": [], "consumption_status": "not_applicable", "notes": "Build development material only from lawful non-test sources before selecting a prompt or retrieval configuration." },
      "test": { "source_split": "answered test", "availability": "available", "allowed_uses": ["historical_reporting", "protocol_correction_audit"], "consumption_status": "confirmation_used", "notes": "The 3902 questions were already used by the historical paired campaign; corrected-parser work must not tune on them." }
    },
    "metrics": { "primary": ["accuracy"], "secondary": ["group_accuracy", "invalid_rate"] },
    "sample_protocol": {
      "protocol_id": "cpsyexam-answered-test-v4-historical",
      "evaluation_role": "test",
      "source_split": "answered test",
      "selection_forbidden": true,
      "mode": "full",
      "examples": { "kind": "exact", "value": 3902 },
      "seed": null,
      "option_permutations": 1,
      "repetitions_per_permutation": 1,
      "api_calls_per_example": 1,
      "expected_total_api_calls": 3902,
      "scoring_unit": "question; report KG/CA crossed with single/multiple choice"
    },
    "provenance_requirements": {
      "model": { "required_fields": ["requested_model", "response_model", "provider", "fingerprint", "temperature", "thinking", "reasoning_effort", "run_id"], "frozen_before_test": true, "forbidden_aliases": ["deepseek-chat", "deepseek-reasoner"] },
      "prompt": { "required_fields": ["prompt_profile", "prompt_version", "prompt_template_sha256"], "frozen_before_test": true },
      "parser": { "required_fields": ["parser_version", "parser_sha256", "invalid_policy"], "frozen_before_test": true },
      "dataset": { "required_fields": ["dataset_revision", "dataset_manifest_sha256", "split", "seed", "case_sha256"], "frozen_before_test": true }
    },
    "paper_compatibility": {
      "status": "partial",
      "reference_protocol": "CPsyExam answered 3902-question test with KG/CA and single/multiple-choice group accuracy.",
      "paper_primary_metrics": ["accuracy", "group_accuracy"],
      "blocking_differences": ["The frozen historical parser could read the A in Answer as the option, and the published paper comparison mixes prompting settings."]
    },
    "current_status": {
      "as_of": "2026-08-01",
      "workflow_state": "blocked",
      "evidence_level": "historical_frozen",
      "summary": "The paired V4 result is valid only under its frozen historical parser; it is not a corrected-parser confirmation.",
      "next_action": "Freeze a strict parser and a lawful non-test development protocol, then preregister any independent confirmation without test tuning."
    }
  }
]
